### ISSUE TITLE
RW Mount from Windows allows to read and delete but does not write

### ISSUE THREAD

**Issue by tuhajbej6** [unfs3/unfs3#43]
Hi,

So we've got unfs3 latest installed on a tiny root-only (Libreelec) server.
It's a tight (almost) read-only distro so I cannot create a different user.

An RW mount using "all-squash" and registry trick to change user ID to anon 65534 allows me to read and browse and execute files. also deleting of a single file, BUT writing and deleting a directory is not allowed.

It does work from other linux machine when mounting root <-> root 

What is wrong, where is the cause ? Any advices ?
I tried all combinations with all-squash, non-squash, etc...  as well as using user ID=0 (root)  and permissions are 777 everywhere.

Currently here is my export:
`/var/media    10.9.8.0/24(rw,async,all_squash,insecure,anonuid=65534,anongid=65534,no_subtree_check)`

**Comment by CendioOssman** [comment]
If the dist is mostly read-only, have you checked that you can do those things locally?

E.g. `su -s /bin/bash - nobody bash -c 'touch /var/media/foo'`

**Comment by tuhajbej6** [comment]
> If the dist is mostly read-only, have you checked that you can do those things locally?
> 
> E.g. `su -s /bin/bash - nobody bash -c 'touch /var/media/foo'`

I mentioned "almost" read only, 
so it can do straight "touch /var/media/foo", but the specific one you mentioned cannot:
```
su -s /usr/bin/bash - nobody bash -c  'touch /var/media/foo'
touch: /var/media/foo: Permission denied

```

**Comment by tuhajbej6** [comment]
> If the dist is mostly read-only, have you checked that you can do those things locally?
> 
> E.g. `su -s /bin/bash - nobody bash -c 'touch /var/media/foo'`

Yes it does, all in /var/media is 777

**Comment by CendioOssman** [comment]
Not sure what happened with your first response, but for posterity:

> I mentioned "almost" read only, 
> so it can do straight "touch /var/media/foo", but the specific one you mentioned cannot:
> ```
> su -s /usr/bin/bash - nobody bash -c  'touch /var/media/foo'
> touch: /var/media/foo: Permission denied
> ```

This would explain the issue. The above command simulates what unfsd does, given your configuration. So there is something in the system still blocking things for that user.

> BUT creating new file and deleting a directory end with error 0x800703EE

That looks like a Windows error code, so I guess this is not a Unix client? I'm afraid that is not something we've tested at all.

How is this set up?

**Comment by CendioOssman** [comment]
No, unfsd should not do anything magical like that. So I wonder if Windows does some extra requests that are confusing things.

Do you think you can get a tcpdump of the communication when this happens?

**Comment by tuhajbej6** [comment]
> No, unfsd should not do anything magical like that. So I wonder if Windows does some extra requests that are confusing things.
> 
> Do you think you can get a tcpdump of the communication when this happens?

Not sure how to tcpdump but strace shows only this when trying to create a new file:
```
  392  0:04 unfsd            unfsd -t
 1573  0:00 grep             grep unfs
kodi:~ # strace -f -p 392
strace: Process 392 attached
restart_syscall(<... resuming interrupted system call ...>) = 0
restart_syscall(<... resuming interrupted restart_syscall ...>) = 1
restart_syscall(<... resuming interrupted restart_syscall ...>) = 0
restart_syscall(<... resuming interrupted restart_syscall ...>) = 1
restart_syscall(<... resuming interrupted restart_syscall ...>) = 1
restart_syscall(<... resuming interrupted restart_syscall ...>) = 92
restart_syscall(<... resuming interrupted restart_syscall ...>) = 0
restart_syscall(<... resuming interrupted restart_syscall ...>) = 0
restart_syscall(<... resuming interrupted restart_syscall ...>) = 0
restart_syscall(<... resuming interrupted restart_syscall ...>) = 0
restart_syscall(<... resuming interrupted restart_syscall ...>) = 0
restart_syscall(<... resuming interrupted restart_syscall ...>) = 68
restart_syscall(<... resuming interrupted restart_syscall ...>) = 1
restart_syscall(<... resuming interrupted restart_syscall ...>) = 1
restart_syscall(<... resuming interrupted restart_syscall ...>) = 0
restart_syscall(<... resuming interrupted restart_syscall ...>) = 1
restart_syscall(<... resuming interrupted restart_syscall ...>) = 1
restart_syscall(<... resuming interrupted restart_syscall ...>) = 100
restart_syscall(<... resuming interrupted restart_syscall ...>) = 0
restart_syscall(<... resuming interrupted restart_syscall ...>) = 0
restart_syscall(<... resuming interrupted restart_syscall ...>) = 0
restart_syscall(<... resuming interrupted restart_syscall ...>) = 0
restart_syscall(<... resuming interrupted restart_syscall ...>) = 0
restart_syscall(<... resuming interrupted restart_syscall ...>) = 0
restart_syscall(<... resuming interrupted restart_syscall ...>) = 0
restart_syscall(<... resuming interrupted restart_syscall ...>) = 0
restart_syscall(<... resuming interrupted restart_syscall ...>) = 0
restart_syscall(<... resuming interrupted restart_syscall ...>) = 116
restart_syscall(<... resuming interrupted restart_syscall ...>) = 1
restart_syscall(<... resuming interrupted restart_syscall ...>) = 1
restart_syscall(<... resuming interrupted restart_syscall ...>) = 120
restart_syscall(<... resuming interrupted restart_syscall ...>) = 0
restart_syscall(<... resuming interrupted restart_syscall ...>) = 0
restart_syscall(<... resuming interrupted restart_syscall ...>) = 0
restart_syscall(<... resuming interrupted restart_syscall ...>) = 0
restart_syscall(<... resuming interrupted restart_syscall ...>) = 0

```

**Comment by tuhajbej6** [comment]
> No, unfsd should not do anything magical like that. So I wonder if Windows does some extra requests that are confusing things.
> 
> Do you think you can get a tcpdump of the communication when this happens?

OK I got it:

```
kodi:~ # tcpdump -s 192 port nfs
tcpdump: verbose output suppressed, use -v or -vv for full protocol decode
listening on eth0, link-type EN10MB (Ethernet), capture size 192 bytes
11:27:04.100333 IP 10.9.8.30.959 > 10.9.8.1.nfs: Flags [S], seq 2165438607, win 64240, options [mss 1460,nop,nop,sackOK], length 0
11:27:04.100450 IP 10.9.8.1.nfs > 10.9.8.30.959: Flags [S.], seq 4145425491, ack 2165438608, win 29200, options [mss 1460,nop,nop,sackOK], length 0
11:27:04.101022 IP 10.9.8.30.959 > 10.9.8.1.nfs: Flags [.], ack 1, win 64240, length 0
11:27:04.101112 IP 10.9.8.30.959 > 10.9.8.1.nfs: Flags [P.], seq 1:93, ack 1, win 64240, length 92: NFS request xid 1741 88 getattr fh Un/2F7661722F6D6564
11:27:04.101153 IP 10.9.8.1.nfs > 10.9.8.30.959: Flags [.], ack 93, win 29200, length 0
11:27:04.101431 IP 10.9.8.1.nfs > 10.9.8.30.959: Flags [P.], seq 1:69, ack 93, win 29200, length 68: NFS reply xid 1741 reply ok 64 getattr unk-ft 23  3700000000 ids 0/1596260352 sz 47413760
11:27:04.101948 IP 10.9.8.30.959 > 10.9.8.1.nfs: Flags [R.], seq 93, ack 69, win 0, length 0
11:27:04.102010 IP 10.9.8.30.927 > 10.9.8.1.nfs: Flags [P.], seq 1814098466:1814098566, ack 3916595572, win 64092, length 100: NFS request xid 1742 96 getattr fh 0,31/9567
11:27:04.102233 IP 10.9.8.1.nfs > 10.9.8.30.927: Flags [P.], seq 1:117, ack 100, win 35376, length 116: NFS reply xid 1742 reply ok 112 getattr DIR 40777 ids 0/0 sz 80
11:27:04.102725 IP 10.9.8.30.927 > 10.9.8.1.nfs: Flags [P.], seq 100:220, ack 117, win 63976, length 120: NFS request xid 1743 116 readdir fh 0,31/9567 0 bytes @ 203640548580392960
11:27:04.102951 IP 10.9.8.1.nfs > 10.9.8.30.927: Flags [P.], seq 117:373, ack 220, win 35376, length 256: NFS reply xid 1743 reply ok 252 readdir
11:27:04.103812 IP 10.9.8.30.907 > 10.9.8.1.nfs: Flags [S], seq 3237160530, win 64240, options [mss 1460,nop,nop,sackOK], length 0
11:27:04.103907 IP 10.9.8.1.nfs > 10.9.8.30.907: Flags [S.], seq 2359904875, ack 3237160531, win 29200, options [mss 1460,nop,nop,sackOK], length 0
11:27:04.104318 IP 10.9.8.30.907 > 10.9.8.1.nfs: Flags [.], ack 1, win 64240, length 0
11:27:04.104388 IP 10.9.8.30.907 > 10.9.8.1.nfs: Flags [P.], seq 1:93, ack 1, win 64240, length 92: NFS request xid 1744 88 getattr fh Un/2F7661722F6D6564
11:27:04.104422 IP 10.9.8.1.nfs > 10.9.8.30.907: Flags [.], ack 93, win 29200, length 0
11:27:04.104587 IP 10.9.8.1.nfs > 10.9.8.30.907: Flags [P.], seq 1:69, ack 93, win 29200, length 68: NFS reply xid 1744 reply ok 64 getattr unk-ft 23  3700000000 ids 0/1596260352 sz 47413760
11:27:04.105065 IP 10.9.8.30.907 > 10.9.8.1.nfs: Flags [R.], seq 93, ack 69, win 0, length 0
11:27:04.105101 IP 10.9.8.30.927 > 10.9.8.1.nfs: Flags [P.], seq 220:320, ack 373, win 63720, length 100: NFS request xid 1745 96 getattr fh 0,31/9567
11:27:04.105261 IP 10.9.8.1.nfs > 10.9.8.30.927: Flags [P.], seq 373:489, ack 320, win 35376, length 116: NFS reply xid 1745 reply ok 112 getattr DIR 40777 ids 0/0 sz 80
11:27:04.105707 IP 10.9.8.30.927 > 10.9.8.1.nfs: Flags [P.], seq 320:440, ack 489, win 63604, length 120: NFS request xid 1746 116 readdir fh 0,31/9567 0 bytes @ 203640548580392960
11:27:04.105908 IP 10.9.8.1.nfs > 10.9.8.30.927: Flags [P.], seq 489:745, ack 440, win 35376, length 256: NFS reply xid 1746 reply ok 252 readdir
11:27:04.106324 IP 10.9.8.30.927 > 10.9.8.1.nfs: Flags [P.], seq 440:600, ack 745, win 63348, length 160: NFS request xid 1747 156 mkdir fh 0,31/9567  [|nfs]
11:27:04.106448 IP 10.9.8.1.nfs > 10.9.8.30.927: Flags [P.], seq 745:893, ack 600, win 36448, length 148: NFS reply xid 1747 reply ok 144 mkdir ERROR: Invalid argument
11:27:04.159194 IP 10.9.8.30.927 > 10.9.8.1.nfs: Flags [.], ack 893, win 63200, length 0
^C
25 packets captured
25 packets received by filter

```

**Comment by CendioOssman** [comment]
Thanks. The dump shows that the issue is not a permissions problem, but rather some invalid flags given to mkdir.

Unfortunately, we don't see those details. Could you try saving a tcpdump to disk so we can open it here? It's the `-w` flag that does that.

**Comment by tuhajbej6** [comment]
Sure, the -w dump is binary so the link is here. 

[https://file.io/fzGscsydxp15](https://file.io/fzGscsydxp15)

It is the same moment when trying to create a new folder.

**Comment by tuhajbej6** [comment]
Does unfs3 make any use of "request-key.conf"
as it is mentioned here ?

https://www.kernel.org/doc/html/v5.8/admin-guide/nfs/nfs-idmapper.html

wt., 19 mar 2024 o 14:52 Pierre Ossman (ThinLinc team) <
***@***.***> napisał(a):

**Comment by tuhajbej6** [comment]
OK one more thing. Maybe there is a user missing in /etc/passwd. 
Can you please take a look ? My system's user are:
```
kodi:~ # cat /etc/passwd
systemd-timesync:x:191:191:systemd-timesync:/:/bin/false
systemd-network:x:193:193:systemd-network:/:/bin/sh
dbus:x:81:81:System message bus:/:/bin/sh
root:x:0:0:Root User:/storage:/bin/sh
nobody:x:65534:65534:Nobody:/:/bin/sh
system:x:430:430:service:/var/run/connman:/bin/sh
avahi:x:495:495:avahi-daemon:/var/run/avahi-daemon:/bin/sh
```

**Comment by tuhajbej6** [comment]
Hi, yet the version got upgraded on that server of mine from 0.9 to 0.11 but still the problem exists.
Using both exports:
`/var/media    10.9.8.0/24(rw,no_root_squash,insecure,no_subtree_check,fsid=0,crossmnt,anonuid=65534,anongid=65534)`
or
`/var/media    10.9.8.0/24(rw,async,all_squash,insecure,anonuid=65534,anongid=65534,no_subtree_check)
`
produce the same message when trying to copy anything into any subdir:
**_Volumen of the file has changed internally in the way that opened file is no longer valid_**

But still I can delete a single file and modify it (ex. txt file)

**Comment by BlueAmulet** [comment]
Some debugging into the issue shows that atomic_attr is returning NFS3ERR_INVAL because of the following conditions:
```
attr.atime.set_it == SET_TO_CLIENT_TIME
attr.mtime.set_it == SET_TO_CLIENT_TIME
```
Removing the two checks does allow Windows to create files and folders, but I am unsure of the consequence of that change.

**Comment by CendioOssman** [comment]
Thanks for figuring that out. That would explain things.

Removing those would remove the guarantee of atomicity. The Windows NFS client expects the file to be created with those timestamps set right away. unfsd is unable to do that. It would need to first create the file, then modify the timestamps. This creates a short time window where the wrong timestamp is set. Which could theoretically cause issues.

It's unclear if this is an issue in practice, so it might be prudent to be more lenient here. But it probably needs a bit of investigation to make sure we don't cause any big problem.
